ma_service,title,layout,meta_title,bigimg,image,tags,categories,transport,location,duration,discount,price
NEWS_TIPS01,"5 mẹo săn vé máy bay giá rẻ",post,"5 mẹo săn vé máy bay giá rẻ","/img/post-news/SAN-VE-MAY-BAY-GIA-RE.webp","/img/post-news/SAN-VE-MAY-BAY-GIA-RE.webp","mẹo săn vé, vé máy bay giá rẻ, kinh nghiệm du lịch","[post-news#tips]","","Toàn quốc","","",""
NEWS_TIPS02,"Kinh nghiệm đặt phòng khách sạn online an toàn",post,"Kinh nghiệm đặt phòng khách sạn online an toàn","/img/post-news/dat-phong-khach-san-online.webp","/img/post-news/dat-phong-khach-san-online.webp","đặt phòng khách sạn, kinh nghiệm du lịch, mẹo du lịch","[post-news#tips]","","Toàn thế giới","","",""
NEWS_TIPS03,"Những lưu ý khi chuẩn bị hành lý đi du lịch",post,"Những lưu ý khi chuẩn bị hành lý đi du lịch","/img/post-news/luu-y-hanh-ly-du-lich.jpg","/img/post-news/luu-y-hanh-ly-du-lich.jpg","hành lý du lịch, chuẩn bị hành lý, mẹo du lịch","[post-news#tips]","","Toàn thế giới","","",""
NEWS_TIPS04,"Cách săn voucher du lịch và ưu đãi hot",post,"Cách săn voucher du lịch và ưu đãi hot","/img/post-news/san-voucher-du-lich.jpg","/img/post-news/san-voucher-du-lich.jpg","voucher du lịch, ưu đãi du lịch, kinh nghiệm tiết kiệm","[post-news#tips]","","Toàn quốc","","",""
NEWS_TIPS05,"Bí quyết du lịch an toàn mùa cao điểm",post,"Bí quyết du lịch an toàn mùa cao điểm","/img/post-news/du-lich-an-toan-mua-cao-diem.jpg","/img/post-news/du-lich-an-toan-mua-cao-diem.jpg","du lịch an toàn, mùa cao điểm, mẹo du lịch","[post-news#tips]","","Toàn thế giới","","",""
NEWS_DEST01,"Top 5 điểm đến hot mùa hè 2025",post,"Top 5 điểm đến hot mùa hè 2025","/img/post-news/diem-den-hot-mua-he.jpg","/img/post-news/diem-den-hot-mua-he.jpg","điểm đến hot, du lịch hè, xu hướng du lịch","[post-news#destination]","","Toàn thế giới","","",""
NEWS_DEST02,"Khám phá Phú Quốc: Thiên đường biển đảo Việt Nam",post,"Khám phá Phú Quốc: Thiên đường biển đảo Việt Nam","/img/post-news/kham-pha-phu-quoc.jpg","/img/post-news/kham-pha-phu-quoc.jpg","phú quốc, du lịch biển đảo, điểm đến nổi bật","[post-news#destination]","","Phú Quốc","","",""
NEWS_DEST03,"Sapa mùa lúa chín vàng: Trải nghiệm không thể bỏ lỡ",post,"Sapa mùa lúa chín vàng: Trải nghiệm không thể bỏ lỡ","/img/post-news/sapa-mua-lua-chin.jpg","/img/post-news/sapa-mua-lua-chin.jpg","sapa, mùa lúa chín, du lịch tây bắc","[post-news#destination]","","Sapa","","",""
NEWS_DEST04,"Khám phá Đà Nẵng – Thành phố đáng sống",post,"Khám phá Đà Nẵng – Thành phố đáng sống","/img/post-news/kham-pha-da-nang.jpg","/img/post-news/kham-pha-da-nang.jpg","đà nẵng, điểm đến nổi bật, du lịch miền trung","[post-news#destination]","","Đà Nẵng","","",""
NEWS_DEST05,"Vẻ đẹp mùa thu Hà Nội",post,"Vẻ đẹp mùa thu Hà Nội","/img/post-news/mua-thu-ha-noi.jpg","/img/post-news/mua-thu-ha-noi.jpg","hà nội, mùa thu, điểm đến lãng mạn","[post-news#destination]","","Hà Nội","","",""
NEWS_GUIDE01,"Hướng dẫn xin visa du lịch tự túc",post,"Hướng dẫn xin visa du lịch tự túc","/img/post-news/huong-dan-xin-visa.jpg","/img/post-news/huong-dan-xin-visa.jpg","xin visa, hướng dẫn visa, du lịch tự túc","[post-news#guide]","","Toàn thế giới","","",""
NEWS_GUIDE02,"Cách đặt tour trọn gói an toàn & tiết kiệm",post,"Cách đặt tour trọn gói an toàn & tiết kiệm","/img/post-news/dat-tour-tron-goi.jpg","/img/post-news/dat-tour-tron-goi.jpg","đặt tour, tour trọn gói, hướng dẫn du lịch","[post-news#guide]","","Toàn quốc","","",""
NEWS_GUIDE03,"Các bước thuê xe du lịch cho gia đình",post,"Các bước thuê xe du lịch cho gia đình","/img/post-news/thue-xe-du-lich-gia-dinh.jpg","/img/post-news/thue-xe-du-lich-gia-dinh.jpg","thuê xe du lịch, hướng dẫn thuê xe, du lịch gia đình","[post-news#guide]","","Toàn quốc","","",""
NEWS_GUIDE04,"Hướng dẫn đặt vé máy bay quốc tế online",post,"Hướng dẫn đặt vé máy bay quốc tế online","/img/post-news/huong-dan-dat-ve-quoc-te.jpg","/img/post-news/huong-dan-dat-ve-quoc-te.jpg","đặt vé máy bay, hướng dẫn quốc tế, kinh nghiệm bay","[post-news#guide]","","Toàn thế giới","","",""
NEWS_GUIDE05,"Checklist chuẩn bị trước chuyến đi nước ngoài",post,"Checklist chuẩn bị trước chuyến đi nước ngoài","/img/post-news/checklist-du-lich-nuoc-ngoai.jpg","/img/post-news/checklist-du-lich-nuoc-ngoai.jpg","checklist du lịch, chuẩn bị du lịch, kinh nghiệm nước ngoài","[post-news#guide]","","Toàn thế giới","","",""
NEWS_EVENT01,"Xu hướng tổ chức team building 2025",post,"Xu hướng tổ chức team building 2025","/img/post-news/team-building-2025.jpg","/img/post-news/team-building-2025.jpg","team building, sự kiện doanh nghiệp, xu hướng sự kiện","[post-news#event]","","Toàn quốc","","",""
NEWS_EVENT02,"Gala dinner: Ý tưởng tổ chức ấn tượng cho doanh nghiệp",post,"Gala dinner: Ý tưởng tổ chức ấn tượng cho doanh nghiệp","/img/post-news/gala-dinner-y-tuong.jpg","/img/post-news/gala-dinner-y-tuong.jpg","gala dinner, tổ chức sự kiện, doanh nghiệp","[post-news#event]","","Toàn quốc","","",""
NEWS_EVENT03,"Hội nghị khách hàng: Bí quyết thành công",post,"Hội nghị khách hàng: Bí quyết thành công","/img/post-news/hoi-nghi-khach-hang.jpg","/img/post-news/hoi-nghi-khach-hang.jpg","hội nghị khách hàng, tổ chức sự kiện, bí quyết thành công","[post-news#event]","","Toàn quốc","","",""
NEWS_EVENT04,"Tổ chức sự kiện ngoài trời: Những điều cần lưu ý",post,"Tổ chức sự kiện ngoài trời: Những điều cần lưu ý","/img/post-news/su-kien-ngoai-troi.jpg","/img/post-news/su-kien-ngoai-troi.jpg","sự kiện ngoài trời, tổ chức sự kiện, lưu ý sự kiện","[post-news#event]","","Toàn quốc","","",""
NEWS_EVENT05,"Xu hướng du lịch MICE tại Việt Nam",post,"Xu hướng du lịch MICE tại Việt Nam","/img/post-news/du-lich-mice-viet-nam.jpg","/img/post-news/du-lich-mice-viet-nam.jpg","du lịch MICE, sự kiện doanh nghiệp, xu hướng du lịch","[post-news#event]","","Toàn quốc","","",""
NEWS_POLICY01,"Chính sách hoàn hủy vé máy bay mới nhất",post,"Chính sách hoàn hủy vé máy bay mới nhất","/img/post-news/chinh-sach-hoan-huy-ve.jpg","/img/post-news/chinh-sach-hoan-huy-ve.jpg","chính sách hoàn vé, hủy vé máy bay, thông tin du lịch","[post-news#policy]","","Toàn thế giới","","",""
NEWS_POLICY02,"Quy định hành lý ký gửi các hãng hàng không",post,"Quy định hành lý ký gửi các hãng hàng không","/img/post-news/quy-dinh-hanh-ly.jpg","/img/post-news/quy-dinh-hanh-ly.jpg","quy định hành lý, hãng hàng không, thông tin du lịch","[post-news#policy]","","Toàn thế giới","","",""
NEWS_POLICY03,"Cập nhật thủ tục xuất nhập cảnh mới nhất",post,"Cập nhật thủ tục xuất nhập cảnh mới nhất","/img/post-news/thu-tuc-xuat-nhap-canh.jpg","/img/post-news/thu-tuc-xuat-nhap-canh.jpg","thủ tục xuất nhập cảnh, thông tin du lịch, chính sách mới","[post-news#policy]","","Toàn thế giới","","",""
NEWS_HEALTH01,"Lưu ý sức khỏe khi đi du lịch nước ngoài",post,"Lưu ý sức khỏe khi đi du lịch nước ngoài","/img/post-news/luu-y-suc-khoe-du-lich.jpg","/img/post-news/luu-y-suc-khoe-du-lich.jpg","sức khỏe du lịch, bảo hiểm du lịch, mẹo sức khỏe","[post-news#health]","","Toàn thế giới","","",""
NEWS_HEALTH02,"Các loại vaccine cần thiết khi du lịch quốc tế",post,"Các loại vaccine cần thiết khi du lịch quốc tế","/img/post-news/vaccine-du-lich-quoc-te.jpg","/img/post-news/vaccine-du-lich-quoc-te.jpg","vaccine du lịch, sức khỏe quốc tế, phòng bệnh du lịch","[post-news#health]","","Toàn thế giới","","",""
NEWS_HEALTH03,"Bảo hiểm du lịch: Vì sao nên mua?",post,"Bảo hiểm du lịch: Vì sao nên mua?","/img/post-news/bao-hiem-du-lich.jpg","/img/post-news/bao-hiem-du-lich.jpg","bảo hiểm du lịch, an toàn chuyến đi, sức khỏe du lịch","[post-news#health]","","Toàn thế giới","","",""