ma_service,title,layout,meta_title,bigimg,image,tags,categories,transport,location,duration,discount,price
SV_VISA_TRAVEL01,"Dịch vụ làm visa du lịch",post,"Dịch vụ làm visa du lịch","/img/visa/dich-vu-lam-visa-du-lich.jpeg","/img/visa/dich-vu-lam-visa-du-lich.jpeg","visa du lịch, hộ chiếu, visa travel, xin visa","[visa#travel]","","Toàn thế giới","","",""
SV_VISA_TRAVEL02,"Tư vấn thủ tục visa du lịch",post,"Tư vấn thủ tục visa du lịch","/img/visa/tu-van-thu-tuc-visa-du-lich.jpg","/img/visa/tu-van-thu-tuc-visa-du-lich.jpg","tư vấn visa, thủ tục visa du lịch, visa travel","[visa#travel]","","Toàn thế giới","","",""
SV_VISA_TRAVEL03,"Gia hạn visa du lịch",post,"Gia hạn visa du lịch","/img/visa/gia-han-visa-du-lich.jpg","/img/visa/gia-han-visa-du-lich.jpg","gia hạn visa, visa du lịch, visa travel","[visa#travel]","","Toàn thế giới","","",""
SV_VISA_BUSINESS01,"Dịch vụ làm visa công tác",post,"Dịch vụ làm visa công tác","/img/visa/dich-vu-lam-visa-cong-tac.png","/img/visa/dich-vu-lam-visa-cong-tac.png","visa công tác, visa business, hộ chiếu công tác","[visa#business]","","Toàn thế giới","","",""
SV_VISA_BUSINESS02,"Tư vấn hồ sơ visa công tác",post,"Tư vấn hồ sơ visa công tác","/img/visa/tu-van-ho-so-visa-cong-tac.jpg","/img/visa/tu-van-ho-so-visa-cong-tac.jpg","tư vấn visa công tác, visa business, hồ sơ visa","[visa#business]","","Toàn thế giới","","",""
SV_VISA_BUSINESS03,"Gia hạn visa công tác",post,"Gia hạn visa công tác","/img/visa/gia-han-visa-cong-tac.webp","/img/visa/gia-han-visa-cong-tac.webp","gia hạn visa công tác, visa business, visa renewal","[visa#business]","","Toàn thế giới","","",""
SV_VISA_STUDY01,"Dịch vụ làm visa du học",post,"Dịch vụ làm visa du học","/img/visa/dich-vu-lam-visa-du-hoc.jpg","/img/visa/dich-vu-lam-visa-du-hoc.jpg","visa du học, visa study, hộ chiếu du học","[visa#study]","","Toàn thế giới","","",""
SV_VISA_STUDY02,"Tư vấn hồ sơ visa du học",post,"Tư vấn hồ sơ visa du học","/img/visa/tu-van-ho-so-visa-du-hoc.jpg","/img/visa/tu-van-ho-so-visa-du-hoc.jpg","tư vấn visa du học, visa study, hồ sơ du học","[visa#study]","","Toàn thế giới","","",""
SV_VISA_STUDY03,"Gia hạn visa du học",post,"Gia hạn visa du học","/img/visa/gia-han-visa-du-hoc.jpg","/img/visa/gia-han-visa-du-hoc.jpg","gia hạn visa du học, visa study, visa renewal","[visa#study]","","Toàn thế giới","","",""
SV_VISA_OTHER01,"Dịch vụ công chứng giấy tờ",post,"Dịch vụ công chứng giấy tờ","/img/visa/dich-vu-cong-chung-giay-to.png","/img/visa/dich-vu-cong-chung-giay-to.png","công chứng giấy tờ, dịch vụ visa, visa other","[visa#other]","","Toàn thế giới","","",""
SV_VISA_OTHER02,"Dịch vụ hợp pháp hóa lãnh sự",post,"Dịch vụ hợp pháp hóa lãnh sự","/img/visa/dich-vu-hop-phap-hoa-lanh-su.jpg","/img/visa/dich-vu-hop-phap-hoa-lanh-su.jpg","hợp pháp hóa lãnh sự, visa other, dịch vụ visa","[visa#other]","","Toàn thế giới","","",""
SV_VISA_OTHER03,"Dịch vụ dịch thuật hồ sơ visa",post,"Dịch vụ dịch thuật hồ sơ visa","/img/visa/dich-vu-dich-thuat-ho-so-visa.jpg","/img/visa/dich-vu-dich-thuat-ho-so-visa.jpg","dịch thuật hồ sơ, visa other, dịch vụ visa","[visa#other]","","Toàn thế giới","","",""